{
  "session_id": "dryrun-user-001",
  "protocol_version": "gates46-user-v1",
  "participant_id_scheme": "P###-hash",
  "consent_status": "dry_run_synthetic",
  "guardian_path_required": true,
  "tasks": [
    "launch_app",
    "complete_learn_workload",
    "offline_relaunch"
  ],
  "usability_instrument": "SUS",
  "deidentified": true,
  "status": "DRY_RUN",
  "irb_claim": "NO_IRB_CLAIM",
  "notes": "Harness only; no IRB approval claimed"
}
